{
  "kind": "show",
  "schema_version": 1,
  "example": true,
  "show_id": "feltwillow-en",
  "language": "en",
  "title": "Feltwillow",
  "description": "EXAMPLE ONLY: an English-language story show; branding and description await approval.",
  "author": "Feltwillow",
  "show_type": "episodic",
  "category": "Kids & Family",
  "subcategory": "Stories for Kids",
  "explicit": false,
  "owner_email": null,
  "hosting": {
    "authority": "undecided",
    "rss_url": null,
    "website_url": null
  },
  "artwork": {
    "url": null,
    "width": null,
    "height": null
  }
}
